"An Intelligent Device Public Parks Cleaner: The Robot Garbot 4.0","L. Plautz Prestes; A. Solange Bos; M. H. Euzebio Batista; J. C. Da Luz Pereira; R. Dutra Ribeiro Fagundes; M. Zaro","Universidade Federal do Rio Grande do Sul, Porto Alegre, RS, BR; Universidade Federal do Rio Grande do Sul, Porto Alegre, RS, BR; Computer Science UNIRITTER, University Center Ritter dos Reis, Porto Alegre, BR; Computer Science UNIRITTER, University Center Ritter dos Reis, Porto Alegre, BR; Universidade FEEVALE, Novo Hamburgo, RS, BR; Universidade Federal do Rio Grande do Sul, Porto Alegre, RS, BR","2019 14th Iberian Conference on Information Systems and Technologies (CISTI)","15 Jul 2019","2019","","","1","6","This paper goal is to describe the stages and results of development of an intelligent device park cleaner a prototype named Garbot 4.0. This robot was builted in the context of Fourth Laureate Award for Excellence in Robotic Engineering, realized in 2017, with the theme of “Environment and Sustainability”, The proposal of competition and of the Garbot 4.0 is the cleaning and maintaining parks. The results are very promise, so far, with results of functions of Garbot 4.0 was successfully realized in arena of tests, validating all main specifications. The results presented in this paper details all the stages, materials, functions and technical description of the Garbot 4.0.","2166-0727","978-9-8998-4349-3","10.23919/CISTI.2019.8760777","","https://ieeexplore.ieee.org/stamp/stamp.jsp?arnumber=8760777","Intelligent device;Cleaner robot;Robotic Engineering","Robot sensing systems;Educational robots;Cleaning;Robot kinematics;Computer science","","","","13","","15 Jul 2019","","","IEEE","IEEE Conferences"
"An Internet of Things Approach for Environmental Quality Management and Laboratory Activity Support","G. Marques; R. Pitarma","Instituto Politécnico da Guarda, UDI – Unidade de Investigação para o Desenvolvimento do Interior, Guarda, Portugal; Instituto Politécnico da Guarda, UDI – Unidade de Investigação para o Desenvolvimento do Interior, Guarda, Portugal","2019 14th Iberian Conference on Information Systems and Technologies (CISTI)","15 Jul 2019","2019","","","1","6","Environmental conditions have a significant impact on health and all human activities. On the one hand, laboratories are spaces characterized by various sources of pollution that can lead to unhealthy indoor environments. On the other hand, laboratory activities, especially in the case of experiments using thermography, require the supervision of several parameters. The proliferation of the Internet of Things paradigm (IoT) shows great potential for the creation of automatic solutions for monitoring indoor environments. In general, people spend about 90% of their time inside buildings so it is significant to use realtime monitoring systems in order to identify bad ambient conditions. The timely detection of poor ambient conditions allows you to plan interventions in the building for enhanced living environments and occupational health. This paper aims to present a laboratory environment conditions supervision solution based on IoT architecture called iLabM+. The solution is composed of prototype hardware for the collection of the data environment and a Web portal for data consulting and analysis. This system allows monitoring of temperature, relative humidity, barometric pressure and air quality. The results obtained are promising and represent a significant contribution to IoT-based environmental quality monitoring systems.","2166-0727","978-9-8998-4349-3","10.23919/CISTI.2019.8760876","","https://ieeexplore.ieee.org/stamp/stamp.jsp?arnumber=8760876","air quality;ambient assisted living;enhanced living enviroments;Internet of Things;occupational health;smart city;smart home","Monitoring;Portals;Internet of Things;Wireless fidelity;Laboratories;Temperature measurement","","2","","","","15 Jul 2019","","","IEEE","IEEE Conferences"
"Engaging Students in Learning with Apps and Critical Games Analysis","A. A. A. Carvalho","Faculdade de Psicologia e de Ciências da Educação; LabTE, CEIS20, Universidade de Coimbra, Coimbra, Portugal","2019 14th Iberian Conference on Information Systems and Technologies (CISTI)","15 Jul 2019","2019","","","1","5","In the course of Games and Learning we used a flipped learning approach, inviting undergraduates to check what they learned from the readings made at home, by solving a quiz online, at the beginning of the class. At the end of each session, they synthesize on a Google form what they have learned. In the second part of the semester, in groups, they had to analyze a video game and a serious game. In this second group work, they had to observe the players to play, and they had to describe their reactions. At the end of the semester, the students filled in an opinion questionnaire about the dynamics of the class and the work done. The reactions of the students were very positive to the approach used and to the fact that the works contributed to the development of the critical ability to analyze digital games.","2166-0727","978-9-8998-4349-3","10.23919/CISTI.2019.8760977","","https://ieeexplore.ieee.org/stamp/stamp.jsp?arnumber=8760977","Flipped Learning;Apps;Digital Games","Games;Google;Instruments;Information systems;Bring your own device;Asphalt;Hospitals","","","","","","15 Jul 2019","","","IEEE","IEEE Conferences"
"Air Quality through Automated Mobile Sensing and Wireless Sensor Networks for Enhanced Living Environments","G. Marques; R. Pitarma","Instituto Politécnico da Guarda, UDI – Unidade de Investigação para o Desenvolvimento do Interior, Guarda, Portugal; Instituto Politécnico da Guarda, UDI – Unidade de Investigação para o Desenvolvimento do Interior, Guarda, Portugal","2019 14th Iberian Conference on Information Systems and Technologies (CISTI)","15 Jul 2019","2019","","","1","7","On one hand, humans typically spent about 90% of their time in indoor environments, therefore, indoor air quality is of the utmost importance as buildings have several sources of pollutants. On the other hand, the ageing of the global population presents a great opportunity for the development of solutions for ambient assisted living. The majority of existing air quality monitoring systems on the market are expensive, do not have direct forms of communication with the user, do not use social networks to share collected data and do not offer support for automated robots. This article presents iAirBot a standalone robot capable of monitoring indoor air quality. A gas sensor and a “Sun Spot” sensor network are used for monitoring air quality. Other sensors can be added to monitor specific pollutants. The results reveal not only that this automated mobile air monitoring solution is feasible as well as that indoor air quality may in some cases be very different from what would be expected. The proposed system can provide an effective form of interaction with the user. The authors believe that in the near future the company's robots will have APIs for data sharing in social networks as well as offer interconnection with indoor monitoring systems.","2166-0727","978-9-8998-4349-3","10.23919/CISTI.2019.8760641","","https://ieeexplore.ieee.org/stamp/stamp.jsp?arnumber=8760641","air quality;ambient assisted living;smart city;smart home;wireless sensor networks","Monitoring;Robot sensing systems;Logic gates;Air quality;Software;Sun","","6","","","","15 Jul 2019","","","IEEE","IEEE Conferences"
"Protocol of Information Recovery in Solid Hard Drives - SSD Using File Carving Techniques","G. Ninahualpa; S. Yoo; T. Guarda; J. Díaz; D. Piccirilli","Departamento de Ciencias de la Computación, Universidad de las Fuerzas Armadas ESPE, Universidad Nacional de La Plata, Grupo de Investigación de Ciberseguridad, IoT e Inteligencia Artificial, Universidad de las Fuerzas Armadas ESPE, Sangolquí, Ecuador, Argentina; Departamento de Ciencias de la Computación, Universidad de las Fuerzas Armadas ESPE, Grupo de Investigación de Ciberseguridad, IoT e Inteligencia Artificial, Universidad de las Fuerzas Armadas ESPE, Sangolquí, Ecuador; Universidad Estatal Peninsula de Santa Elena, Santa Elena, Santa Elena, EC; Universidad Nacional de la Plata, La Plata, AR; Universidad Nacional de la Plata, La Plata, AR","2019 14th Iberian Conference on Information Systems and Technologies (CISTI)","15 Jul 2019","2019","","","1","6","This paper proposes protocol of information recovery in solid hard disks - SSD by means of the use of File Carving techniques, analyzing factors of incidence, scenarios of affectation, type of file to recover, as well as the fragmentation of the same. In this regard, it hopes to be a support in the work of computer expertise or auditing in the field of information retrieval in SSD.","2166-0727","978-9-8998-4349-3","10.23919/CISTI.2019.8760783","","https://ieeexplore.ieee.org/stamp/stamp.jsp?arnumber=8760783","File Carving;carver;affectation scenario;methodology;protocol","Semantics;Protocols;Information systems;Solids;Software;Visualization;Biomedical imaging","","1","","","","15 Jul 2019","","","IEEE","IEEE Conferences"
"Development of a Graphical Interface for Continuous and Holistic Care Providers","J. Campos; N. Martins; D. Portela; S. Pereira; R. Simoes","Instituto Politecnico do Cavado e do Ave, Barcelos, Braga, PT; Instituto Politecnico do Cavado e do Ave, Barcelos, Braga, PT; Instituto Politecnico do Cavado e do Ave, Barcelos, Braga, PT; Instituto Politecnico do Cavado e do Ave, Barcelos, Braga, PT; Instituto Politecnico do Cavado e do Ave, Barcelos, Braga, PT","2019 14th Iberian Conference on Information Systems and Technologies (CISTI)","15 Jul 2019","2019","","","1","7","The present work is framed by the research and technological development project `ActiveRest', which aims to develop a textile mattress guard to prevent pressure ulcers (PUs). This solution intends to integrate a monitoring system, based on a network of pressure, temperature and humidity sensors, together with a non-invasive actuation system that operates autonomously and locally, promoting immediate relief of pressure in critical areas. In addition, it is also intended to develop a mobile application, which continuously communicate with the mattress guard, allowing caregivers to be able to, at any time, consult the patient's condition. This article presents the work carried out under the digital technology component, namely the graphic design and programming work required to reach the solution presented. This solution will provide the means of interaction between the user and the mattress guard, in order to access the data generated by the device. In this case, the main focus was the design of a graphic interface, simple and adaptable to different target audience, facilitating their reading and interaction.","2166-0727","978-9-8998-4349-3","10.23919/CISTI.2019.8760994","","https://ieeexplore.ieee.org/stamp/stamp.jsp?arnumber=8760994","pressure ulcers;mobile application;digital technologies;healthcare mobile solution","Mobile applications;Temperature sensors;Color;Monitoring;Skin;Medical services","","1","","26","","15 Jul 2019","","","IEEE","IEEE Conferences"
"Visualization in Reproducible Science","B. M. Marques; J. R. Da Silva; T. Devezas","Universidade do Porto, Porto, Porto, PT; Universidade do Porto, Porto, Porto, PT; Universidade do Porto, Porto, Porto, PT","2019 14th Iberian Conference on Information Systems and Technologies (CISTI)","15 Jul 2019","2019","","","1","4","The increasing prevalence of Open Science has brought reproducibility to the center of discussion of the scientific community as a requirement for ensuring the transparency and correctness of a research workflow. The current publishing landscape is evolving, as shown by the emergence of notebook technologies powering a new generation of interactive Web Journals. These use state-of-the-art interactive graphical visualizations and on-demand data processing to research papers, allowing readers to trace every step of the process, from raw data to the finalized visualization. Since there are many Research Notebook technologies and interactive graphical visualization solutions to choose from, we present a summary comparative overview of Web Journals and the Notebook engines that power the interactive, data driven visualizations inside their publications. Given our focus on visualization, our metrics are the support for the most advanced, popular and widely adopted data visualization frameworks. We conclude that Jupyter Notebook is currently the best alternative for the average user, given its popularity and support, combined with broad support for powerful and high-level interactive visualization grammars.","2166-0727","978-9-8998-4349-3","10.23919/CISTI.2019.8760672","","https://ieeexplore.ieee.org/stamp/stamp.jsp?arnumber=8760672","reproducibility;open science;visualization;open data;research notebooks;FAIR","Data visualization;Libraries;Visualization;Publishing;Measurement;Standards;Engines","","","","29","","15 Jul 2019","","","IEEE","IEEE Conferences"
"Analysis of the ICT use in Companies of Castela and Leão and Northern of Portugal","J. P. Pereira; J. Exposto; V. Ostritsova","Instituto Politecnico de Braganca, Braganca, BraganÃ§a, PT; Instituto Politecnico de Braganca, Braganca, BraganÃ§a, PT; Politécnico de Bragança; Campus Sta Apolónia, Bragança, 5300-302, Portugal","2019 14th Iberian Conference on Information Systems and Technologies (CISTI)","15 Jul 2019","2019","","","1","6","ICT are one of the most important value for the economic growth. Technology, information, and knowledge has an important impact in peripheral regions when they want to participate in the global market. Exists a lot of discussion about the digital divide between countries but little in relation to the regions and especially Less Favoured Regions (LFR). There is a clear evidence that these internal disparities can lead to the continued marginalization of people and regions “disconnected” from global information networks, which support the modern economy and causing strong inequalities. By other side, data available about the ICT use are normally from central regions and not Less Favoured Regions. With this study, we made a study to understand the ICT use by small enterprises and entrepreneurs from peripheral regions from Portugal and Spain: 5 Spanish regions (Leon, Zamora, Salamanca, Valladolid, Ávila) and 2 Portuguese (Alto Tâmega e Terras de Trâs-os-Montes). For that, 433 surveys were carried out (170 in the Portuguese regions and 263 in Spanish areas), included in project COMPETIC.","2166-0727","978-9-8998-4349-3","10.23919/CISTI.2019.8760996","","https://ieeexplore.ieee.org/stamp/stamp.jsp?arnumber=8760996","ICT;Less Favoured Regions;Small enterprises;entrepreneurs","Software;Information systems;Cloud computing;Digital divide;Companies;Economics","","1","","","","15 Jul 2019","","","IEEE","IEEE Conferences"
"Higher Education in Brazil: Privatization and Transformation","A. C. Braun Endo; L. A. De Farias","Universidade de Sao Paulo, Sao Paulo, SÃ£o Paulo, BR; Universidade de Sao Paulo, Sao Paulo, SÃ£o Paulo, BR","2019 14th Iberian Conference on Information Systems and Technologies (CISTI)","15 Jul 2019","2019","","","1","4","This paper aims to map the scenario of private higher education in Brazil in recent years (2013-17) from the Census of Higher Education (2018). Exploratory in nature, it is based on a qualitative and inductive research strategy, with the objective of analyzing 3 dimensions: growth of private higher education institutions (IES), 10 major educational groups that dominate the scenario in Higher Education in Brazil and evolution of distance education in public and private HEIs. The results indicate that the Brazilian private educational segment occupies 87.91% of the market share, with the 10 largest educational groups dominating 31.6% of the market. In contrast, the government system reduced its investment by 66.6% in the same period (2013-2017), which facilitated the private educational domain. Although there is an increase in distance courses (48.51%), the number of graduates is still relatively low (26.5%) in this category.","2166-0727","978-9-8998-4349-3","10.23919/CISTI.2019.8760661","","https://ieeexplore.ieee.org/stamp/stamp.jsp?arnumber=8760661","Brazil;private higher education;educational groups;distance learning","Information systems;Privatization;Government;Investment;Computer aided instruction;Bills of materials","","","","","","15 Jul 2019","","","IEEE","IEEE Conferences"
"Are Smart Cities Reshaping Local E-Govemment Research?","G. P. Dias","Universidade de Aveiro, Aveiro, Aveiro, PT","2019 14th Iberian Conference on Information Systems and Technologies (CISTI)","15 Jul 2019","2019","","","1","4","In this paper it is presented an exploratory study of the impact that the development of smart cities has for local e-government research. To inform the study, a bibliometric analysis is performed using the Scopus database as a source. Specifically, bibliometrics are used to compare three sets of documents: research documents addressing smart cities in general; research documents addressing local e-government; and research documents addressing smart cities in the scope of e-government. Despite the limitations that are inherent to a bibliometric analysis, the study allows the conclusions that the relevance of smart cities within local e-government research has grown to represent about 20% of the number of document published annually in the field, and that this contributed to broaden the range of subjects dealt with in the area.","2166-0727","978-9-8998-4349-3","10.23919/CISTI.2019.8760778","","https://ieeexplore.ieee.org/stamp/stamp.jsp?arnumber=8760778","smart cities;e-government;local government;bibliometrics","Smart cities;Electronic government;Bibliometrics;Databases;Mathematics","","1","","8","","15 Jul 2019","","","IEEE","IEEE Conferences"
"Conceptual model to represent body signals in the learning process","M. C. Sobrinho; C. Pantoja Lima","Universidade Federal do Oeste do Para, Santarem, PA, BR; Universidade Federal do Oeste do Para, Santarem, PA, BR","2019 14th Iberian Conference on Information Systems and Technologies (CISTI)","15 Jul 2019","2019","","","1","4","Several educators, for decades have been contributing to the education join more theory and practice. However, the learning strategies need to be based on the diversity of styles present in the classroom, having the teacher first understood the student's need through the interpretation of their emotions, expressed from body signals such as heart beats, temperature, brain waves, facial and body expressions. Thus, the objective of this work is to study and propose a model to represent these body signals and relate them to the learning process, using computational resources based on technologies such as artificial intelligence, machine learning, big data and the internet of things by means of 4 steps: selection of technologies; signal capture; identification and analysis of captured data; and analysis based on theories and learning styles. As for the methodology, it presents an approach of a qualitative and quantitative nature and a theoretical basis based on bibliographic research. The research is under development.","2166-0727","978-9-8998-4349-3","10.23919/CISTI.2019.8760704","","https://ieeexplore.ieee.org/stamp/stamp.jsp?arnumber=8760704","emotion;learning;technologies;theories of learning;body signals","Big Data;Machine learning;Robot sensing systems;Computational modeling;Data models;Learning (artificial intelligence)","","","","","","15 Jul 2019","","","IEEE","IEEE Conferences"
"Graph of Significant Terms for Source Code","P. M. Del Carpio","Departamento de Ingeniería y Matemáticas, Universidad La Salle, Arequipa, Perú","2019 14th Iberian Conference on Information Systems and Technologies (CISTI)","15 Jul 2019","2019","","","1","6","When developers are tasked to modify source code of unknown systems, they have to employ considerable time and effort in activities for understanding the system implementation and locate units of source code. This work proposes a graph that supports the localization of directories which hold significant terms based on their frequency, using criteria of organization of source code directories. Popular open source projects were analyzed, the results show relevant features of visualization and information.","2166-0727","978-9-8998-4349-3","10.23919/CISTI.2019.8760692","","https://ieeexplore.ieee.org/stamp/stamp.jsp?arnumber=8760692","graph;significant term;source code","Software;Visualization;Information systems;XML;Adaptation models;Task analysis;System implementation","","","","","","15 Jul 2019","","","IEEE","IEEE Conferences"
"Internet of Things Electromechanical Method and Device for New or Installed Gas Stoves: Making Home Safier","M. González-Palacio; M. Luna-DelRisco; L. González-Palacio; J. Cuatindioy-Imbachi; J. J. Quiza-Montealegre; C. Arrieta-González; S. Villegas-Moncada; C. Arredondo; F. Quintero","Universidad de Medellin, Medellin, CO; Universidad de Medellin, Medellin, CO; Universidad de Medellin, Medellin, CO; Universidad de Medellin, Medellin, CO; Universidad de Medellin, Medellin, CO; Universidad de Medellin, Medellin, CO; Universidad de Medellin, Medellin, CO; Universidad de Medellin, Medellin, CO; Universidad de Medellin, Medellin, CO","2019 14th Iberian Conference on Information Systems and Technologies (CISTI)","15 Jul 2019","2019","","","1","6","Electronic devices have been dabbled into houses to perform automatic tasks and fulfill different needs such as illumination, cooking, air conditioning, surveillance, among others. Furthermore, those elements can collect data from the environment in order to be processed and give better products and services, so, Internet of Things capabilities arises to home, highly cohesive with domotics. However, for developing countries, smart appliances are expensive, and old fridges, washing machines, etc., are still operative, so they must not to be discarded. Other very used appliances are stoves, which work with heating methods like electrical resistances, electrical induction or natural gas. The last one is the most used in a plenty of countries, due to its advantages regarding cost, for instance. Nonetheless, bad manipulation can cause gas leakages, and furthermore, injuries to people and conflagrations, affecting human lives and assets. Thus, a need has been identified regarding gas safety of gas stoves, conserving the installed base. This work shows the results of the main research and design considerations of a new cutting-edge technology that protects people of bad manipulation of already installed or new gas stoves, including the Internet of Things in order to monitor in real-time possible gas leakages and take actions.","2166-0727","978-9-8998-4349-3","10.23919/CISTI.2019.8760860","","https://ieeexplore.ieee.org/stamp/stamp.jsp?arnumber=8760860","Internet of Things;domotics;safety;conflagration;gas stoves","Valves;Natural gas;Heating systems;Internet of Things;Temperature sensors;Furnaces;Sparks","","","","21","","15 Jul 2019","","","IEEE","IEEE Conferences"
"COBIT 5.0: Case Study Study Student Census MINEDUC","E. M. Macas Ruiz; M. D. R. Romero Pazmiño; L. d. C. Tacuri Peña; J. R. Caiza Caizabuano; G. E. Cueva Castillo","Escuela de Informática y Multimedia, Universidad Internacional del Ecuador, Ecuador; Postgrado Tecnología de la Información y Comunicación, Universidad Internacional SEK, Quito, Ecuador; Facultad de Ciencias Administrativas y Económicas, Universidad Internacional del Ecuador, Ecuador; Analista Senior Informática, Universidad de las Fuerzas Armadas ESPE, Ecuador; Departamento de Apoyo y Seguimiento, Coordinación de Educación Zona 7, Ecuador","2019 14th Iberian Conference on Information Systems and Technologies (CISTI)","15 Jul 2019","2019","","","1","6","The Ministry of Education (MINEDUC) is the body in charge of guaranteeing and increasing the quality of education in terms of ways of teaching and the offer of it in different levels; the inclusion and participative interculturality in the educational context are an inherent part in the fulfillment of institutional objectives; an assertive planning of resources in physical infrastructure, technology, teaching staff, allocation and the distribution of appropriate spaces for trainees in training as a priority in the educational state policy; that is why, considering these conditions, the MINEDUC implemented the National Student Census application, which is currently used in all fiscal, fiscomisional, private and municipal educational institutions (EI). The student census system stores the global information of the Educational Institutions (IE); In this case study, the existing processes and the way that COBIT 5.0 can contribute to the integration of said processes will be analyzed, identifying the most suitable improvement points to improve their quality of response information.","2166-0727","978-9-8998-4349-3","10.23919/CISTI.2019.8760762","","https://ieeexplore.ieee.org/stamp/stamp.jsp?arnumber=8760762","COBIT;MINEDUC;student census;information;quality;integration","Information systems;Manuals;Planning;Resource management;Training;ISO Standards","","","","","","15 Jul 2019","","","IEEE","IEEE Conferences"
