"Is it a lay or medico-scientific concept? Automatic classification in two languages","P. M. Santos; C. T. Lopes","Universidade do Porto, Porto, Porto, PT; Universidade do Porto, Porto, Porto, PT","2019 14th Iberian Conference on Information Systems and Technologies (CISTI)","15 Jul 2019","2019","","","1","4","Searching for health information is the third most popular activity on the Internet. There is evidence that query suggestions in lay and medico-scientific terminology improve health information retrieval by who is not a health professional. Developing systems that suggest queries in these terminologies requires knowing if concepts are lay or medico-scientific. In this paper, we propose and compare approaches to compute the degree of association of a concept to lay and medico-scientific terminology. We use different thesauri for this purpose and use the cosine similarity to measure the closeness of concepts with subsets of those thesauri. The evaluation of our approaches uses an existing glossary containing concepts in both terminologies in English and Portuguese and a and a set of queries submitted by users and classified by health professionals as lay or medical-scientific. We concluded that the best method to classify a concept uses the CHV vocabulary as a subset.","2166-0727","978-9-8998-4349-3","10.23919/CISTI.2019.8760745","","https://ieeexplore.ieee.org/stamp/stamp.jsp?arnumber=8760745","health information retrieval;thesauri;terminology;query suggestions","Vocabulary;Terminology;Unified modeling language;Tumors;Frequency measurement;Thesauri;Information systems","","1","","11","","15 Jul 2019","","","IEEE","IEEE Conferences"
"Learning Programming Using Educational Robotics","J. T. Aparicio; S. Pereira; M. Aparicio; C. J. Costa","Instituto Universitario de Lisboa (ISCTE-IUL); Instituto Universitario de Lisboa (ISCTE-IUL); Instituto Universitário de Lisboa (ISCTE-IUL), Universidade Nova de Lisboa; Advance/CSG, Universidade de Lisboa","2019 14th Iberian Conference on Information Systems and Technologies (CISTI)","15 Jul 2019","2019","","","1","6","Research reported in this paper fits into the generic problem of programming learning. In this context, the primary research objective of this study is to analyze if robotics facilitates programming learning. To tackle the problem, we developed a robotic kit and a small course. The robotic kit used Arduino platform and was presented in the context of this course. The course consisted of programming concepts. This course was taught to higher education students, with no previous programming knowledge. In the end, we analyzed the impact of the course. Results demonstrate that students showed interest in using robotics to learn computer programming. Results also showed the main adoption determinants of the robotic kit. Enjoyment is the most relevant to the robotic kit intention to use. However, perceived ease is the dimension that has more impact on robotic kit usage.","2166-0727","978-9-8998-4349-3","10.23919/CISTI.2019.8760709","","https://ieeexplore.ieee.org/stamp/stamp.jsp?arnumber=8760709","Educational Robotics;Arduino;Programming Component;Adoption Model","Programming profession;Light emitting diodes;Education;Robot sensing systems","","7","","30","","15 Jul 2019","","","IEEE","IEEE Conferences"
"Agile Process Optimization: An Approach Using the CMMI and GQM","F. Rainho; J. Barreiros","Instituto Politecnico de Coimbra, Coimbra, Coimbra, PT; Instituto Politecnico de Coimbra, Coimbra, Coimbra, PT","2019 14th Iberian Conference on Information Systems and Technologies (CISTI)","15 Jul 2019","2019","","","1","6","The CMMI model catalogs good practices in many process areas. It is therefore a very useful resource for improving software development processes. However, its complete and comprehensive nature can create difficulties, particularly when considering agile development environment, where lightweight development practices are preferred. In this work, we describe a methodology for optimizing agile processes based on CMMI, with reduced impact on pre-existing agility. This is achieved by defining improvement objectives with the GQM approach, that allow precise and intentional selection of CMMI practices with high impact towards the desired objectives. This methodology was validated in a medium size enterprise with good results.","2166-0727","978-9-8998-4349-3","10.23919/CISTI.2019.8760924","","https://ieeexplore.ieee.org/stamp/stamp.jsp?arnumber=8760924","Software Development Process;Agile;Scrum;CMMI;GQM","Software;Measurement;Monitoring;Capability maturity model;Information systems;Scrum (Software development);Laser radar","","1","","","","15 Jul 2019","","","IEEE","IEEE Conferences"
"Plan for Automatic Adaptation of NAO Robots to Slippery Floors","G. Franco; A. Coimbra; M. Crisóstomo; J. P. Ferreira","Universidade de Coimbra, Coimbra, Coimbra, PT; Universidade de Coimbra, Coimbra, Coimbra, PT; Universidade de Coimbra, Coimbra, Coimbra, PT; Universidade de Coimbra, Coimbra, Coimbra, PT","2019 14th Iberian Conference on Information Systems and Technologies (CISTI)","15 Jul 2019","2019","","","1","5","This work focuses on preventing the humanoid robot NAO from falling, when walking on slippery surfaces, and on following Zero Moment Point (ZMP) reference trajectories. The presented strategy uses human-like gait with varying parameters such as step length and walking speed in order to adapt the robot's locomotion to different foot-floor friction coefficients. The gait parameters are chosen in order to minimize the probability of slipping, leading to an undesired fall. This choice of gait parameters is based on the analysis of the ground reaction forces and human behavior. Also, gait adaptation is further improved in order to follow a desired ZMP trajectory, through the use of a controller that offsets the hip and ankle joint angles. The novelty of this work lies on the fact that machine learning techniques are used to adapt the gait parameters and joint corrections to make the robot more resistant to both slipping and external disturbances.","2166-0727","978-9-8998-4349-3","10.23919/CISTI.2019.8760942","","https://ieeexplore.ieee.org/stamp/stamp.jsp?arnumber=8760942","ZMP;Human Gait;Slippery Floors;Friction Coefficient;Intelligent controller","Friction;Legged locomotion;Trajectory;Floors;Humanoid robots;Foot","","1","","31","","15 Jul 2019","","","IEEE","IEEE Conferences"
"ChatPy: Conversational agent for SMEs","P. Pérez; F. De-La-Cruz; X. Guerrón; G. Conrado; P. Quiroz-Palma; W. Molina","Pontificia Universidad Catolica del Ecuador, Quito, Pichincha, EC; Pontificia Universidad Catolica del Ecuador, Quito, Pichincha, EC; Universidad Central del Ecuador, Quito, Pichincha, EC; Universidad Central del Ecuador, Quito, Pichincha, EC; Universidad Laica Eloy Alfaro de Manabi, Manta, ManabÃ­, EC; Universidad Laica Eloy Alfaro de Manabi, Manta, ManabÃ­, EC","2019 14th Iberian Conference on Information Systems and Technologies (CISTI)","15 Jul 2019","2019","","","1","6","In the present research, we study the components and principles for chatbot built, perform an analysis and comparison of the different current technological platforms for Chatbots is done. The majority of SMEs in Ecuador feel the lack of support tools for customer service in their IT platforms, that is why they have seen in the development of this technology a solution to increase their sales and reach their customers. We propose ChatPy as an appropriate conversational agent for use in SMEs. An implementation of ChatPy is carried out in a wholesaler automotive spare parts, as a case of study. The ChatPy implementation uses the PSP framework. The results show improvement in sales, customer service and customer satisfaction.","2166-0727","978-9-8998-4349-3","10.23919/CISTI.2019.8760624","","https://ieeexplore.ieee.org/stamp/stamp.jsp?arnumber=8760624","chatbots;personal software process;dialogflow;webhook;SME;natural language processing","Software;Facebook;Natural language processing;Artificial intelligence;Tools;Neural networks;Engines","","4","","17","","15 Jul 2019","","","IEEE","IEEE Conferences"
"Spectral and spatial assessment of the Ikonos images fusion, using the Principal Components, Brovey Transform and Multiplicative","J. Medina; L. Becerra González; E. Upegui","Universidad Distrital Francisco Jose de Caldas, Bogota, CO; Facultad Seccional Centro de Gestión Agroempresarial del Oriente, SENA, Colombia; Universidad Distrital Francisco Jose de Caldas, Bogota, CO","2019 14th Iberian Conference on Information Systems and Technologies (CISTI)","15 Jul 2019","2019","","","1","6","This article presents the assessment of the fusion of Ikonos satellite images using three methods, the first corresponds, Principal Component second Brovey Transform and the Multiplication method implemented in the Matlab Software, with the objective of identifying which of the three methods improves the special resolution without significant loss of spectral richness. Assessment of two implemented methods were performed using the following indices: ERGAS (spectral and spatial), RASE, Universal Quality Index Qu, and Correlation Index, where the best results on spatially and spectrally richness were obtained with first method called transform Brovey.","2166-0727","978-9-8998-4349-3","10.23919/CISTI.2019.8760873","","https://ieeexplore.ieee.org/stamp/stamp.jsp?arnumber=8760873","Principal Component;Transform Brovey;Multiplication method;satellite images;fusion;Ikonos","Image resolution;Image color analysis;Matlab;Transforms;Information systems;Software;Satellites","","","","","","15 Jul 2019","","","IEEE","IEEE Conferences"
"Arcade platform in education: Analysis the impact of a preparation game for the ENEM","M. L. Braga; V. Martins De Sousa","Instituto Federal de Educacao Ciencia e Tecnologia Catarinense, Blumenau, SC, BR; Instituto Federal de Educacao Ciencia e Tecnologia Catarinense, Blumenau, SC, BR","2019 14th Iberian Conference on Information Systems and Technologies (CISTI)","15 Jul 2019","2019","","","1","4","This paper presents the development process of a game that simulates the resolution of questions of the ENEM (Exame Nacional do Ensino Médio), which makes possible, in an attractive way to students, another possibility of exercising their knowledge throughout their preparation for the exam. In order to achieve this objective, a qualitative research was developed, which demonstrates, in its results, the interest of students in using a platform like the one created in this project. In addition to the research with students, studies were made in the field of education technology, investigating the impacts of this approach in learning. The game, called FlipENEM, was developed to run on an arcade machine in a way that is visually more attractive than the similar platforms already existent, which are also studied in this project. For the production of the software and assembly of the arcade machine, specific tools such as NetBeans, Java and MySQL Server were used. After the initial tests of the arcade with students in a campus, it was possible to observe its positive impacts, as reported by students in a research carried out later on.","2166-0727","978-9-8998-4349-3","10.23919/CISTI.2019.8760930","","https://ieeexplore.ieee.org/stamp/stamp.jsp?arnumber=8760930","arcade platform;ENEM;gamification;technology in education","Games;Education;Tools;Databases;Software;Proposals;Java","","1","","10","","15 Jul 2019","","","IEEE","IEEE Conferences"
"Model for Risk Assessment in Dams with Fuzzy Sets Application","S. R. Leite; R. M. Chaim; S. B. S. Monteiro","Agencia Nacional de Energia Eletrica, Brasilia, DF, BR; Universidade de Brasilia, Brasilia, DF, BR; Universidade de Brasilia, Brasilia, DF, BR","2019 14th Iberian Conference on Information Systems and Technologies (CISTI)","15 Jul 2019","2019","","","1","8","Risk management involves both objective and subjective factors. In principle, objective factors are expressed by numerical values being classified by limit values or ranges, while subjective factors express values that can hardly be represented numerically. The problem of evaluation tends to worsen when events must be compared, and a selection or ordering must be performed. For this reason, the importance of considering defined processes to help select and prioritize those who are most relevant to the institution. The current work presents a proposal of solution to help manage the demands related to the process of inspection and classification of dam safety in a regulatory agency. The method, by application of Decision Making in Fuzzy Environment, had as objective to indicate which projects should be prioritized by the inspection team, based on criteria from common terms used in your daily routine. Its application allowed to measure and guarantee the consistency of the judgments along the process, minimizing risks, promoting more rationalization and administrative transparency.","2166-0727","978-9-8998-4349-3","10.23919/CISTI.2019.8760990","","https://ieeexplore.ieee.org/stamp/stamp.jsp?arnumber=8760990","Dam Safety;Risk Management;Fuzzy Logic;Decision Method","Dams;Risk management;Indexes;Inspection;Safety;Monitoring;Adaptation models","","","","","","15 Jul 2019","","","IEEE","IEEE Conferences"
"The Procedure for Processing Images from a Low-cost UAV","P. Sedlák; J. Komárková; O. Mačín; J. Jech","Univerzita Pardubice, Pardubice, CZ; Univerzita Pardubice, Pardubice, CZ; Department of Crisis Management, Regional Authority of the Pardubice Region, Pardubice, the Czech Republic; Univerzita Pardubice, Pardubice, CZ","2019 14th Iberian Conference on Information Systems and Technologies (CISTI)","15 Jul 2019","2019","","","1","4","Remote sensing methods have been used successfully to monitor changes in the landscape. At present, unmanned aerial vehicles (UAVs) are also increasingly used. The article shows how to use the middle-class drone, specifically DJI Phantom 3 with a built-in camera, to monitor and document changes in the vicinity of small water bodies where a part of the shore is poorly accessible or totally unavailable. The obtained data can be further processed by conventional digital image processing methods such as image classification, highlighting through spectral indexes, or even visually comparing.","2166-0727","978-9-8998-4349-3","10.23919/CISTI.2019.8760952","","https://ieeexplore.ieee.org/stamp/stamp.jsp?arnumber=8760952","image processing;UAV;detection of changes","Monitoring;Sea measurements;Vegetation mapping;Drones;Biomedical monitoring;Ice","","2","","14","","15 Jul 2019","","","IEEE","IEEE Conferences"
"Data collection in SDN networks with contextual analysis","C. J. Miguel; F. J. B. V. Neto; J. A. Santos; P. N. M. Sampaio","Universidade Salvador, Salvador, BA, BR; Universidade Salvador, Salvador, BA, BR; Universidade Salvador, Salvador, BA, BR; Universidade Salvador, Salvador, BA, BR","2019 14th Iberian Conference on Information Systems and Technologies (CISTI)","15 Jul 2019","2019","","","1","6","The concept of Context-based networks allows enriching the network management since it considers the global state (context) of the computational system through the characteristics of the user, network and presentation devices providing a broader approach for traffic optimization. In this work we propose the application of a context-based traffic optimization solution called Context-Aware Adaptive Routing Framework (CAARF-SDN). The goal of this paper is to present a solution for context notifications recovery from the computational system which is applied within CAARF-SDN. These context notifications are related to information of Quality of Service (QoS), Quality of Device (QoD) and estimated Quality of Experience (QoE), which will result in a new metric called Quality of Context (QoC). As a result, this metric is applied to assess traffic optimization in an SDN network.","2166-0727","978-9-8998-4349-3","10.23919/CISTI.2019.8760999","","https://ieeexplore.ieee.org/stamp/stamp.jsp?arnumber=8760999","QoS;QoD;QoE;SDN;Network Optimization;Traffic Engineering","Quality of service;Quality of experience;Monitoring;Optimization;Software;Routing;Information systems","","1","","","","15 Jul 2019","","","IEEE","IEEE Conferences"
"Teaching and Learning with Digital Media","M. M. Teixeira; C. D. De Aquino; A. S. Dos Santos; J. V. De Souza; C. A. De Morais; J. Do Ramo Silva; M. M. Dos Santos Miranda; L. U. Da Silva; Á. Rocha","FACET, João Pessoa, Paraíba, Brasil; FACET, João Pessoa, Paraíba, Brasil; FACET, João Pessoa, Paraíba, Brasil; FACET, João Pessoa, Paraíba, Brasil; FACET, João Pessoa, Paraíba, Brasil; FACET, João Pessoa, Paraíba, Brasil; FACET, João Pessoa, Paraíba, Brasil; FACET, João Pessoa, Paraíba, Brasil; Universidade de Coimbra, Coimbra, Coimbra, PT","2019 14th Iberian Conference on Information Systems and Technologies (CISTI)","15 Jul 2019","2019","","","1","6","Contemporaneously, digital medias are used as educational interfaces in virtual learning environments responsible for the divulging of various cultural activities on schools or universities, with programs dedicated education, culture and entertainment. In other words, this is a new way of learning and cultural production to those learners with access to cyberspace, characterized by mutual interaction, where each member is involved in building the cooperative relationship, affecting each other of reciprocal way. The present paper features a conceptual approach concerning the foundations of Vodcast, Podcast and Web Radio, showing the main differences theoretical and technical between the concepts and their educative potentialities in cyberspace. The aim of the research works focuses on the analysis of educational experiences with the Vodcast interface. Given the characteristics of the study and in order to find an answer to the initial question of investigation: The Vodcast can be used in online education? The methodology used is empirical-descriptive and was conducted on the Internet during the second quarter of 2018.","2166-0727","978-9-8998-4349-3","10.23919/CISTI.2019.8760925","","https://ieeexplore.ieee.org/stamp/stamp.jsp?arnumber=8760925","Digital Medias;Education;Communication;Learn;Teach","Education;Internet;Media;Streaming media;Cultural differences;Digital audio broadcasting;Entertainment industry","","","","13","","15 Jul 2019","","","IEEE","IEEE Conferences"
"Sentiment Analysis in Online Reviews Classification using Text Mining Techniques","M. Águeda; P. Rita; P. Guerreiro","Instituto Universitário de Lisboa (ISCTE-IUL), Lisboa, Portugal; Universidade Nova de Lisboa, Lisboa, Lisboa, PT; Instituto Universitário de Lisboa (ISCTE-IUL), Business Research Unit (BRU-IUL), Lisboa, Portugal","2019 14th Iberian Conference on Information Systems and Technologies (CISTI)","15 Jul 2019","2019","","","1","6","The growth of social media in recent years has led to an increase in online reviews that reflects consumer opinions. Firms benefit greatly from making this information available in order to respond more effectively to consumer dissatisfaction and to exploit market opportunities by observing standards that may represent unsatisfied needs. The present study aims to address this problem through a survey based on the Yelp platform. To this end, 14,000 comments related to different tourism products were used and text mining techniques and topic models were applied to find the main latent topics discussed in the online comments and their associated sentiments. The study presents 20 latent topics from online discussions and reveals that the topic that discusses “Air Travel” themes is the one with a lower sentiment connotation on average and should therefore be the subject of a deeper evaluation.","2166-0727","978-9-8998-4349-3","10.23919/CISTI.2019.8760671","","https://ieeexplore.ieee.org/stamp/stamp.jsp?arnumber=8760671","Text Mining;Online Reviews;Sentiments Analysis;Natural Language Processing;Topic Models","Text mining;Social networking (online);Atmospheric modeling;Sentiment analysis;Internet;Information management","","2","","","","15 Jul 2019","","","IEEE","IEEE Conferences"
"NIESIM: A software for estimating the value of information in mobile networks","A. Mendes; P. Godinho","Universidade de Coimbra, Coimbra, Coimbra, PT; Universidade de Coimbra, Coimbra, Coimbra, PT","2019 14th Iberian Conference on Information Systems and Technologies (CISTI)","15 Jul 2019","2019","","","1","6","In this paper we introduce NIESIM (Network Information Economics Simulation), a software for simulating a mobile communications scenario and studying the value of information used in mobile network management. The modelling principles and the simulation strategy used to design and develop NIESIM software are introduced together with its high level architecture. Simulation results are briefly presented along with the discussion of the findings for one use case.","2166-0727","978-9-8998-4349-3","10.23919/CISTI.2019.8760941","","https://ieeexplore.ieee.org/stamp/stamp.jsp?arnumber=8760941","Simulation;Value of Information;Telecommunications","Base stations;Economics;Biological system modeling;Telecommunications;Quality of service;Mobile communication;Context modeling","","","","11","","15 Jul 2019","","","IEEE","IEEE Conferences"
"Codeflex: A Web-based Platform for Competitive Programming","M. Brito; C. Gonçalves","Instituto Politecnico da Guarda, Guarda, Guarda, PT; Instituto Politecnico da Guarda, Guarda, Guarda, PT","2019 14th Iberian Conference on Information Systems and Technologies (CISTI)","15 Jul 2019","2019","","","1","6","The academic environment is undoubtedly one of the main means of introduction to the field of computer programming, however, in this environment, where practice is crucial for the development of solid foundations, the number of given assignments falls short from ideal, especially because of the time it takes to evaluate the proposed solutions. To fill this gap, a web platform has been implemented to serve as a repository of programming problems, for practice and learning, but also with a section for competitive programming. Above all things, the platform is capable of evaluating user's submissions in real time. The solution for evaluating submissions involves the use of compilers associated with their programming language and a parallel execution to bring improvements in resource usage efficiency.","2166-0727","978-9-8998-4349-3","10.23919/CISTI.2019.8760776","","https://ieeexplore.ieee.org/stamp/stamp.jsp?arnumber=8760776","Codeflex;competitive programming;programming tournament;automatic assessment;web platform","Programming profession;Task analysis;Servers;Java;C# languages;C++ languages","","7","","16","","15 Jul 2019","","","IEEE","IEEE Conferences"
"Prioritization of processes for IT Governance improvement - Case Study for DPU / Brazil","A. P. Bernardi da Silva; P. Londe; M. e. Governança; R. Gravina; M. Terto de Holanda; A. P. F. Araúdo; R. T. de Sousa","Universidade Catolica de Brasilia, Taguatinga, DF, BR; Universidade Catolica de Brasilia, Taguatinga, DF, BR; Universidade de Brasilia, Brasilia, DF, BR; Universidade de Brasilia, Brasilia, DF, BR; Universidade Catolica de Brasilia, Taguatinga, DF, BR; Universidade de Brasilia, Brasilia, DF, BR; Departamento de Engenharia Elétrica, Laboratório de Tecnologias de Tomada de Decisão (LATITUDE), Universidade de Brasília (UnB)","2019 14th Iberian Conference on Information Systems and Technologies (CISTI)","15 Jul 2019","2019","","","1","6","This work consists of the development of a strategy for prioritizing COBIT5 processes that can foster improvements in governance and technology management adhering to Information Technology (IT) governance indice, iGovTI. For this, the relationship between COBIT processes and the themes involved in the iGovTI of the Brazilian Federal Public Administration (APF) was mapped. The frequency of these processes and the critical items of the indexes were identified. Through the analysis of value, the COBIT processes with greater institutional relevance were prioritized.","2166-0727","978-9-8998-4349-3","10.23919/CISTI.2019.8760747","","https://ieeexplore.ieee.org/stamp/stamp.jsp?arnumber=8760747","COBIT5 Processes;Governance and IT Management;Public Administration;Value Analysis","Monitoring;Technology management;Information technology;Indexes;Stakeholders;US Department of Defense;Instruments","","","","","","15 Jul 2019","","","IEEE","IEEE Conferences"
