"Linear Programming with CPLEX: An Illustrative Application Over the Internet CPLEX in Fortran 90","M. Barros; M. Casquilho","Universidade de Lisboa, Lisboa, Lisboa, PT; Universidade de Lisboa, Lisboa, Lisboa, PT","2019 14th Iberian Conference on Information Systems and Technologies (CISTI)","15 Jul 2019","2019","","","1","6","The Internet provides a medium for solving problems, namely scientific, for the industry or academia, an important one being Linear Programming (LP), illustrated here as an application of computing “over the Internet”, our style of computing. We present the use of CPLEX, a powerful LP solver, through its API with a Fortran 90 program, a combination scarcely seen, which we implemented, solving two exemplificative problems. The computing application runs on the Linux server of the university, as might be of a company, needing no proprietary plug-ins (as Java, Flash). Our objectives are: to provide an open solution to LP problems; to remind the use of the CPLEX API called from Fortran; and to indicate the Internet as a convenient computing medium. This problem and many others can be freely solved on the authors' webpages.","2166-0727","978-9-8998-4349-3","10.23919/CISTI.2019.8760632","","https://ieeexplore.ieee.org/stamp/stamp.jsp?arnumber=8760632","Computing over the Internet;Linear Programming;CPLEX;Fortran 90","Internet;Linear programming;Dairy products;Browsers;Fish;Sparse matrices;Linux","","9","","36","","15 Jul 2019","","","IEEE","IEEE Conferences"
"Improved Humanoid Gait Using Learning-Based Analysis of a New Wearable 3D Force System: Work Programme","L. Almeida; V. Santos; J. P. Ferreira","Dept. of Mechanical Engineering of Aveiro, Institute of Electronics and Informatics Engineering of Aveiro (IEETA), Aveiro, Portugal; Dept. of Mechanical Engineering of Aveiro, Institute of Electronics and Informatics Engineering of Aveiro (IEETA), Aveiro, Portugal; Dept. of Electrical Engineering, Superior Institute of Engineering of Coimbra Institute of Systems and Robotics (ISR), Coimbra, Portugal","2019 14th Iberian Conference on Information Systems and Technologies (CISTI)","15 Jul 2019","2019","","","1","4","The aim of this work is to develop a new framework for exploiting humanoid adaptive gait on different grounds, especially slippery floors with a low friction coefficient. To achieve this, the idea is to (1) enhance and extend a system for real-time measurement of the Ground Reaction Forces (GRFs) of a walking humanoid robot, (2) to develop a robot controller, and (3) to use machine learning techniques to interpret the GRFs and thus adapt the robot controller in order to achieve a robot able to walk on different grounds. The overall system contribution is the improvement and diversity of humanoids locomotion capacities, leading to a more easily integration of these robots into different areas where they can collaborate with humans.","2166-0727","978-9-8998-4349-3","10.23919/CISTI.2019.8760604","","https://ieeexplore.ieee.org/stamp/stamp.jsp?arnumber=8760604","Humanoid robot;Instrumented system;Robot control;Machine learning;Adaptative gait","Humanoid robots;Legged locomotion;Robot sensing systems;Floors;Footwear;Force","","","","28","","15 Jul 2019","","","IEEE","IEEE Conferences"
"Study and analysis of data journalism practices and techniques in Ecuador","D. Rosero; D. Rivera-Rogel; I. Marín-Gutiérrez","Diario La Hora, Loja, Ecuador; Universidad Tecnica Particular de Loja, Loja, Loja, EC; Universidad Tecnica Particular de Loja, Loja, Loja, EC","2019 14th Iberian Conference on Information Systems and Technologies (CISTI)","15 Jul 2019","2019","","","1","5","Technological advances are making it easier for news to be transmitted through different media thanks to digitalization and the Internet. But the promised potential quickly faded: the lack of investment, excessive voluntarism and distance companies/research led the communication industry to successive failures, with the closure of thousands of media around the world. Proposals are made to explore the possibilities of mobile devices and find an exit for the crisis that affects the communication companies. Our research focuses on offering a first approach to the implementation of Data Journalism in Ecuador, the tools they use and if there is a section dedicated to this branch of journalism. The Ecuadorian media still need to develop Data Journalism. The medium that broadcasts news with data is El Comercio.","2166-0727","978-9-8998-4349-3","10.23919/CISTI.2019.8760940","","https://ieeexplore.ieee.org/stamp/stamp.jsp?arnumber=8760940","Data Journalism;innovative practices;journalistic techniques;Ecuador","Internet;Media;Visualization;Portals;Companies","","","","","","15 Jul 2019","","","IEEE","IEEE Conferences"
"Computational Platform for the Assisted Diagnosis of Patients with Aphasia","D. J. Lancheros-Cuesta; A. Ivan Cruz; E. Bernal-Alzate","Grupo de investigación AVARC, Universidad de La Salle; Grupo de investigación AVARC, Universidad de La Salle; Grupo de investigación AVARC, Universidad de La Salle","2019 14th Iberian Conference on Information Systems and Technologies (CISTI)","15 Jul 2019","2019","","","1","4","The diagnostic systems of aphasia are tools that allow the specialist to recognize the degree of the disorder that a patient possesses, in this way facilitate and follow up the treatment that allows the patient to recover speech through therapies. This article shows the development of a computational platform that allows the configuration and execution of tests to make a diagnosis in patients with aphasia. The activities that the doctor can configure and design on the platform include different levels of difficulty that will be stored in a database, which depending on the agility and ability of the user, will give the specialist support to generate their diagnosis.","2166-0727","978-9-8998-4349-3","10.23919/CISTI.2019.8760828","","https://ieeexplore.ieee.org/stamp/stamp.jsp?arnumber=8760828","computational platform;aphasia;adaptation;database","Unified modeling language;Speech recognition;Information systems;Computational modeling;Databases;Visualization;Tools","","","","","","15 Jul 2019","","","IEEE","IEEE Conferences"
"Development of an APP for the functional referencing of the population with visual disability","F. A. Simanca H.; F. Blanco Garrido; P. E. Carreño H.; M. Alonso Moncada","Universidad Libre - Campus Cali, Cali, CO; Universidad Libre - Campus Cali, Cali, CO; Universidad Libre - Campus Cali, Cali, CO; Universidad Libre - Campus Cali, Cali, CO","2019 14th Iberian Conference on Information Systems and Technologies (CISTI)","15 Jul 2019","2019","","","1","7","Advances in the field of satellite geo-referencing have allowed the development of new technologies that help populations in conditions of special vulnerability, in this case, with visual disability, a concept that includes people with total blindness and low permanent vision. In Colombia, people with more cases of visual disability are in the central zone, in the case of Bogotá there are considerable cases, according to the number of the population, that require attention in the different localities, for this reason, regulations of inclusion within the social and productive field, as well as alternatives for improving mobility and security. This article is developed within the framework of the research project “Current state of social inclusion of people with disabilities supported in ICT and the development of technological support applications”, which led researchers to the development of technological tools as support a disabled population, allowing the design of functional referencing software that will guide people with visual disabilities in the processes of location, selection and access for the use of the Integrated Public Transport System (SITP) of the city of Bogotá - Colombia.","2166-0727","978-9-8998-4349-3","10.23919/CISTI.2019.8760680","","https://ieeexplore.ieee.org/stamp/stamp.jsp?arnumber=8760680","Georeferencing;Visual Geosemantic Disability;Geographic Information System;Global Positioning System;Public space;Public transport","Visualization;Global Positioning System;Software;Sociology;Statistics;Information systems;Google","","","","","","15 Jul 2019","","","IEEE","IEEE Conferences"
"Fuzzy Cognitive Maps to Evaluate the Influence of the Infants About Home Buying Decisions","D. G. Cataño; M. S. Arbeláez; A. Peña","Universidad EIA, Envigado, Grupo de Investigación en Inteligencia Computacional y Automática (GIICA), Antioquia; Universidad EIA, Envigado, Grupo de Investigación en Inteligencia Computacional y Automática (GIICA), Antioquia; Universidad EIA, Envigado, Grupo de Investigación en Inteligencia Computacional y Automática (GIICA), Antioquia","2019 14th Iberian Conference on Information Systems and Technologies (CISTI)","15 Jul 2019","2019","","","1","6","The child has become a key member of the family nucleus, taking a key role on decision making. He is constantly involved directly or indirectly in decisions regarding the consumption products. Having said that the child becomes the object of study, therefore it's important to evaluate the impact a child in the purchase of food products using a fuzzy neural model. This methodology consists of two phases. Phase 1 evaluates all involved agents (child, parents, product) independently and pointing out that the latter two present some inconsistencies due to the structure of the model. Finally, in phase two of the model consists of combining phase one output variables infant, parents and products evidencing coherence between the level of influence estimated and the level of influence established for a particular scenario.","2166-0727","978-9-8998-4349-3","10.23919/CISTI.2019.8760887","","https://ieeexplore.ieee.org/stamp/stamp.jsp?arnumber=8760887","infant as a consumer;infant influence;family decisions making;food products;fuzzy logic neural network","Information systems;Fuzzy cognitive maps;Decision making;Food products;Biological system modeling;Visualization","","1","","","","15 Jul 2019","","","IEEE","IEEE Conferences"
"Enhancing Learnings with Internet of Things: PAprICa project","",,"2019 14th Iberian Conference on Information Systems and Technologies (CISTI)","15 Jul 2019","2019","","","1","5","The Internet of Things (IoT) is considered an emerging technology in relation to which an impact on society is considered comparable to the Industrial Revolution of the 18th century. In educational contexts its potential results essentially from the ability to amplify access to relevant information to the construction of knowledge based on the specific context of the user. In this doctoral research, it's intended to study the use of IoT in the theoretical and practical dimensions, as a didactic resource to promote interdisciplinary learnings in educational contexts of the 3rd Cycle of Basic Education (7th to 9th grade), with emphasis on the programmatic contents of Mathematics, Natural Sciences, Geography, Physics and Chemistry.","2166-0727","978-9-8998-4349-3","10.23919/CISTI.2019.8760610","","https://ieeexplore.ieee.org/stamp/stamp.jsp?arnumber=8760610","Internet of Things;Education;Didactic resource","Monitoring;Internet of Things;Information systems;Education;Distributed Bragg reflectors;Feeds","","2","","","","15 Jul 2019","","","IEEE","IEEE Conferences"
"Acceptance of electronic games by the senior population","A. M. Pinheiro; B. Alturas; A. Oliveira","(ISCTE-IUL) ISTAR-IUL, Instituto Universitário de Lisboa, Lisboa, Portugal; (ISCTE-IUL) ISTAR-IUL, Instituto Universitário de Lisboa, Lisboa, Portugal; (ISCTE-IUL) ISTAR-IUL, Instituto Universitário de Lisboa, Lisboa, Portugal","2019 14th Iberian Conference on Information Systems and Technologies (CISTI)","15 Jul 2019","2019","","","1","4","The phenomenon of growth of the elderly population associated with information and communication sciences and technologies has inspired several research projects that seek alternatives to include this part of the population to this new reality. From the bibliographical survey on the state of the art, most of the studies considered the variables gender, physical situation, digital inclusion and socialization of the elderly. A study appended [20] considered the variables gaming narrative, social interaction and health condition as direct predictors of intention to use digital games, proposing a model of use and acceptance of the extended technologies. In this context, and in view of this identified gap, this research proposal seeks to identify characteristics that facilitate and/or promote the acceptance of electronic games, their use and the learning of information and communication technologies by the elderly population. These characteristics will be used as variables to be incorporated into the TAM-TPB model [19].","2166-0727","978-9-8998-4349-3","10.23919/CISTI.2019.8760944","","https://ieeexplore.ieee.org/stamp/stamp.jsp?arnumber=8760944","Models of acceptance and use of technology;Elderly population;Electronic games","Senior citizens;Games;Statistics;Information systems;Software;Context modeling","","1","","","","15 Jul 2019","","","IEEE","IEEE Conferences"
"Allocation of shared resources","F. Agostini; D. L. La Red Martínez","Universidad Nacional del Nordeste, Corrientes, AR; Universidad Nacional del Nordeste, Corrientes, AR","2019 14th Iberian Conference on Information Systems and Technologies (CISTI)","15 Jul 2019","2019","","","1","6","When it comes to shared environments, where processes distributed in process nodes access critical shared resources in the mode of distributed mutual exclusion, it is important to know how they are managed and the order in which the demand for resources by the processes is resolved. In this work, through an aggregation operator, a consensus mechanism is proposed to establish the order in which resources are allocated to groups of processes. Consensus is understood as the agreement that must be reached for the allocation of all the resources requested by each group of processes. To model this consensus, it is necessary to take into account that the processes may form groups of processes or be independent, the state of the nodes where each of them is located, the computational load, the number of processes, the process priorities, the use of the CPU, the use of the main memory, virtual memory, etc. These characteristics make it possible to evaluate the conditions for agreeing on the order in which resource allocations will be made, ordered by process group.","2166-0727","978-9-8998-4349-3","10.23919/CISTI.2019.8760901","","https://ieeexplore.ieee.org/stamp/stamp.jsp?arnumber=8760901","Aggregation Operators;Communication Between Groups of Processes;Mutual Exclusion;Operating Systems","Resource management;Information systems;Computational modeling;Load modeling;Operating systems;Media","","","","","","15 Jul 2019","","","IEEE","IEEE Conferences"
"Methodology with Python Technology and Social Network Analysis Tools to Analyze the Work of Students Collaborating in Facebook Groups","L. M. Romero-Moreno","Universidad de Sevilla, Sevilla, AndalucÃ­a, ES","2019 14th Iberian Conference on Information Systems and Technologies (CISTI)","15 Jul 2019","2019","","","1","6","Universities and institutions began to create their virtual campuses by using eLearning platforms whether commercial or not. Within these, it has highlighted among other tools instead of the didactic forums where students among themselves and students and teaching teams could discuss and in general build knowledge within a collaborative context. The data coming from these forums have been analyzed, with different techniques, and have allowed obtaining some very interesting conclusions. However, in recent academic years there is a clear trend of migration of collaborative work that previously occurred in the forums to social networks and mobiles. This poses a problem since these tools are not coordinated by the teaching teams. A preliminary work analyzes this trend and points out the consequences to which it may give rise. The present work exposes a methodology to automate the information obtained from Facebook working group, which have been designed by the students themselves.","2166-0727","978-9-8998-4349-3","10.23919/CISTI.2019.8760969","","https://ieeexplore.ieee.org/stamp/stamp.jsp?arnumber=8760969","Learning analytics;collaborative learning;collaborative interactions;Analysis Social Networks","Tools;Facebook;Collaboration;Electronic learning;Information systems","","3","","11","","15 Jul 2019","","","IEEE","IEEE Conferences"
"Validation of convolutional layers in deep learning models to identify patterns in multispectral images","A. Peña; I. Bonet; D. Manzur; M. Góngora; F. Caraffini","Universidad EIA, Grupo de Investigación en Inteligencia Computacional y Automática (GIICA), Envigado, Colombia; Universidad EIA, Grupo de Investigación en Inteligencia Computacional y Automática (GIICA), Envigado, Colombia; Universidad EIA, Grupo de Investigación en Inteligencia Computacional y Automática (GIICA), Envigado, Colombia; DeMontfort University, Institute for Artificial Intelligence (AIA), Leicester, England; DeMontfort University, Institute for Artificial Intelligence (AIA), Leicester, England","2019 14th Iberian Conference on Information Systems and Technologies (CISTI)","15 Jul 2019","2019","","","1","6","The convolutional neural networks (CNN) are considered as a particular case of the Deep Learning neural networks, and have been widely used for the extraction of features in images, audio files or text recognition. For the automatic extraction of features from multispectral images, many researchers have appealed to the use of CNN models, which integrate layers with different structures in context with the solution of a problem, which suggests quite a challenge. That is why, in this article, we propose a method to evaluate the stability in the design of convolutional layers for labeling and identification of palm cultivation units from multispectral images. The structure of the proposed convolutional layer will be given in terms of a fuzzy feature map, obtained as a result of the Cartesian product of three vegetation indices commonly used to evaluate plant vigor in this type of crops (NDVI, GNDVI, RVI), represented as compact maps (radial basis functions). The stability in the design will be given in terms of the dominance of the main diagonal that defines the structure of a convolutional layer obtained as a result of the Cartesian product of two compact maps that represent the same multispectral image.","2166-0727","978-9-8998-4349-3","10.23919/CISTI.2019.8760741","","https://ieeexplore.ieee.org/stamp/stamp.jsp?arnumber=8760741","Convolutional Layer;Deep Learning Models;Convolutional Neural Networks;Dominance Index;Fuzzy Cognitive Map","Deep learning;Vegetation mapping;Indexes;Adaptation models;Feature extraction;Convolutional neural networks","","9","","","","15 Jul 2019","","","IEEE","IEEE Conferences"
"Seniors and technology: overcoming the barriers of the digital world","I. Ribeiro","Universidade dos Acores, Ponta Delgada, Ilha de SÃ£o Miguel, PT","2019 14th Iberian Conference on Information Systems and Technologies (CISTI)","15 Jul 2019","2019","","","1","7","The demographic changes that began in the last century are reflected by an increasingly aging population and are an unavoidable reality. Following the current paradigm of aging (active aging), technologies are expected to be important to minimize the impact of the aging process, promoting quality of life, both to combat loneliness and also to ensure safety and the health of the elderly. From the bibliographic research that studies and documents the relationship of the older with technology and the personal experience of teaching Information and Communication Technologies (ICTs) to seniors, we present methodologies and tools that can provide the elderly with the skills to take advantage of technology potential and exercise easy and efficiently full citizenship. Developing new learning opportunities and activities as well as providing information about them is important as it enables the elderly to be motivated to participate in a new type of useful learning for both seniors and society.","2166-0727","978-9-8998-4349-3","10.23919/CISTI.2019.8760985","","https://ieeexplore.ieee.org/stamp/stamp.jsp?arnumber=8760985","seniors;ICTs;elarning","Internet;Aging;Senior citizens;Information systems;Europe;Software;Laser radar","","","","","","15 Jul 2019","","","IEEE","IEEE Conferences"
"Detection model of similar datasets","J. Acedo; M. Fernández-Sellers; A. Lozano-Tello","Universidad de Extremadura, Caceres, Extremadura, ES; Universidad de Extremadura, Caceres, Extremadura, ES; Universidad de Extremadura, Caceres, Extremadura, ES","2019 14th Iberian Conference on Information Systems and Technologies (CISTI)","15 Jul 2019","2019","","","1","6","The number of datasets that are represented in open data formats is increasing. However, despite of the fact that many of them also have the same subject, they do not follow the same representation schemes, which derives from a problem of data use by users and developers, who find difficulties to compare data from differents sources due to the heterogeneity of the schemes. This article proposes a detection model of similar datasets, as a previous step to the unification of their representation schemes.","2166-0727","978-9-8998-4349-3","10.23919/CISTI.2019.8760782","","https://ieeexplore.ieee.org/stamp/stamp.jsp?arnumber=8760782","open data;datasets;metadata;semantic similarity","Law enforcement;Portals;Integrated circuits;Safety;Software engineering;Silicon compounds","","","","","","15 Jul 2019","","","IEEE","IEEE Conferences"
"Identification of representative terms of datasets","M. Fernández-Sellers; J. Acedo; A. Lozano-Tello","Universidad de Extremadura, Caceres, Extremadura, ES; Universidad de Extremadura, Caceres, Extremadura, ES; Universidad de Extremadura, Caceres, Extremadura, ES","2019 14th Iberian Conference on Information Systems and Technologies (CISTI)","15 Jul 2019","2019","","","1","6","The development of open data portals is increasingly widespread internationally, and they are high demanded by software applications' developers. However, when trying to use similar data from different portals, they found the problem of lack of homogenization. This article collects techniques to analyze the terms that appear in the description of the datasets and represent their content semantically. With these techniques, a model is proposed to identify the most suitable terms, with the aim that they can be used in datasets' selection or unification processes.","2166-0727","978-9-8998-4349-3","10.23919/CISTI.2019.8760664","","https://ieeexplore.ieee.org/stamp/stamp.jsp?arnumber=8760664","open data;datasets;metadata;terms' weight","Portals;Resource description framework;Metadata;Software;W3C;Vocabulary","","1","","","","15 Jul 2019","","","IEEE","IEEE Conferences"
"Committees","",,"2019 14th Iberian Conference on Information Systems and Technologies (CISTI)","15 Jul 2019","2019","","","1","16","Provides a listing of current committee members and society officers.","2166-0727","978-9-8998-4349-3","10.23919/CISTI.2019.8760938","","https://ieeexplore.ieee.org/stamp/stamp.jsp?arnumber=8760938","","","","","","","","15 Jul 2019","","","IEEE","IEEE Conferences"
"[Copyright notice]","",,"2019 14th Iberian Conference on Information Systems and Technologies (CISTI)","15 Jul 2019","2019","","","1","1","Presents the copyright information for the conference. May include reprint permission information.","2166-0727","978-9-8998-4349-3","10.23919/CISTI.2019.8760956","","https://ieeexplore.ieee.org/stamp/stamp.jsp?arnumber=8760956","","","","","","","","15 Jul 2019","","","IEEE","IEEE Conferences"
"Organización, Socios & Patrocinadores / Organization, Partners & Sponsors","",,"2019 14th Iberian Conference on Information Systems and Technologies (CISTI)","15 Jul 2019","2019","","","1","1","The conference organizers greatly appreciate the support of the various corporate sponsors listed.","2166-0727","978-9-8998-4349-3","10.23919/CISTI.2019.8760725","","https://ieeexplore.ieee.org/stamp/stamp.jsp?arnumber=8760725","","","","","","","","15 Jul 2019","","","IEEE","IEEE Conferences"
"Preface","Á. Rocha; I. Pedrosa; M. P. Cota; R. Gonçalves",Universidade de Coimbra; Coimbra Business School-ISCAC; Universidad de Vigo; Universidad de Trás-os-Montes e Alto Douro,"2019 14th Iberian Conference on Information Systems and Technologies (CISTI)","15 Jul 2019","2019","","","1","1","A CISTI'2019 (14ª Conferência Ibérica de Sistemas e Tecnologias de Informação) foi um evento técnico-científico realizado na Coimbra Business School – Instituto Superior de Contabilidade e Administração de Coimbra, entre 19 e 22 de junho de 2019, numa organização conjunta da AISTI (Associação Ibérica de Sistemas e Tecnologias de Informação), Coimbra Business School-ISCAC e Universidade de Coimbra.","2166-0727","978-9-8998-4349-3","10.23919/CISTI.2019.8760910","","https://ieeexplore.ieee.org/stamp/stamp.jsp?arnumber=8760910","","Business;Information systems;Conferences;Silicon carbide","","","","","","15 Jul 2019","","","IEEE","IEEE Conferences"
"2019 14th Iberian Conference on Information Systems and Technologies (CISTI)","",,"2019 14th Iberian Conference on Information Systems and Technologies (CISTI)","15 Jul 2019","2019","","","1","1","Presents the title page of the proceedings record.","2166-0727","978-9-8998-4349-3","10.23919/CISTI.2019.8760734","","https://ieeexplore.ieee.org/stamp/stamp.jsp?arnumber=8760734","","","","2","","","","15 Jul 2019","","","IEEE","IEEE Conferences"
